Page Number,Content,Tags
Page 1,cuserskassem anisonedrive debreceni egyetemasztalhpotestvideosdmp understanding basic tool part battle robust security plan involves strategy searching vulnerability addressing attacker planning interruption critical business function domain cover identifying vulnerability managing risk developing disaster recovery business continuity plan vulnerability management ongoing process organisation proactively identify vulnerability document discovered vulnerability make decision handle vulnerability order implement response mitigate important vulnerability monitor effective deploy response managing vulnerability always effective less costly dealing consequence successful attack first step vulnerability management identify vulnerability exist environment first step vulnerability identification collect comprehensive descriptive information environment hardware software component comprehensive inventory made descriptive information component including detailed version information comprehensive inventory compiled component compared list database known vulnerability identify intersection indicate vulnerability exists one deploy component food fresh know good cybersecurity build customer trust organisation implemented change control process document configuration change infrastructure confident software hardware inventory stay date still scanned verify periodically stay current latest vulnerability fact vulnerability exists diploid component necessarily mean attack imminent vulnerability exploited must external threat realised specific vulnerability main purpose vulnerability management reduce organisation attack surface mitigating many vulnerability possible within budgetary constraint result organisation operating limited budget best approach implementing vulnerability mitigation qualitatively quantitatively assess relative impact discovered vulnerability apply budget vulnerability deemed damaging organisation decides vulnerability mitigated goal reduce opportunity attacker successfully exploit vulnerability carry attack mitigating vulnerability always mean removing vulnerability mean make less dangerous organization last step,"['vulnerability managing', 'vulnerability management', 'managing vulnerability']"
Page 2,vulnerability management assess mitigation ensure exposure vulnerability less deploying mitigation youre mitigation job organization attack service smaller point process repeat continually result finding new vulnerability way mitigate cuserskassem anisonedrive debreceni egyetemasztalhpotestvideosdmp attacker cybersecurity professional use reconnaissance gather information target environment attacker use reconnaissance identify weakest component component environment cybersecurity professional carry task identify vulnerability attacker two main type reconnaissance helpful build picture target environment passive reconnaissance process collecting information target environment without interacting environment directly active reconnaissance collect environmental information interacting environment analysing response knowing use active passive reconnaissance prepares organisation build solid defense cyberattack advantage passive reconnaissance information collection occur stealthy manner target environment alerted passive reconnaissance activity internet search engine social medium great source information organisation person doesnt take long collect demographic descriptive information target technique using internet search engine find detailed information entity process called google hacking google hacking involves using specific syntax constructing google search engine query return information online entity social medium account organisation personnel also return valuable information job posting also repository valuable environmental information example organisation advertising apache web server security specialist stand reason organisation us apache web server job applicant requirement often divulge important environmental architectural detail online resource passive reconnaissance include site published leaked password strategic search engine showdown census open web browser navigate http colon slash slash wwwshonenjumpcom,"['vulnerability management', 'environment cybersecurity', 'vulnerability deploying']"
Page 3,cuserskassem anisonedrive debreceni egyetemasztalhpotestvideosdmp another useful website passive reconnaissance way back machine found archiveorg way machine store archived version website go back year find every website represented database exist looking old version organization website reveal lot information organisation open web browser navigate http colon slash slash archiveorg type lokicom result page show many time website learnt keycom captured select date calendar see website look like day see website captured time november th march th let select year pick date calendar look like way machine provide lot information company changed time main approach reconnaissance active reconnaissance carrying active reconnaissance goal communicate target environment determine resource exist within network resource one common tool used active reconnaissance map map utility stand network mapper fulfills name quite well within map scan network find node active port open node even make educated guess operating system node running initial map scan one likely return active node help develop high level view network architecture process active reconnaissance used map network called enumeration window powershell prompt type map minus capital select inner key keyboard map utility scan network report open port possible operating system service information find many tool available help collect information network including tool like netcat wireshark one tool assist collecting information network environment sending network traffic node network analysing result active reconnaissance generally accurate passive reconnaissance risk person carrying reconnaissance discovered active reconnaissance utility generate traffic network security device detect potentially classify malicious activity short stealth important use passive reconnaissance first use active technique sparingly,"['map utility', 'like netcat', 'information tool']"
Page 4,cuserskassem anisonedrive debreceni egyetemasztalhpotestvideosdmp testing phase vulnerability identification really extension active reconnaissance phase testing port scanning often us many tool used initial active reconnaissance main difference intensity scan quantity traffic sent node simple icmp packet sent suspected node may sufficient report note alive determine port open service running port many packet sent node testing port scanning effective way collect information environment attacker may try use inmate utility favourite tool use port scanning multiple tool available either work similar fashion map provide user friendly front end map sophisticated unattended port scanning comprehensive package nessus openvas provide aggressive port scanning environment analysis userfriendly front end main goal testing port scanning phase collect much information possible operating system service target environment node running attacker cybersecurity professional know service running node identifying component vulnerable becomes possible example brand new vulnerability microsoft internet information service ii web server published attacker would want know vulnerability might attack vector specific target testing phase report target run linux operating system apache web server ii vulnerability would attacker good thats learning much possible target node help choose vulnerability may way compromise one node cuserskassem anisonedrive debreceni egyetemasztalhpotestvideosdmp linux open greenbone security manager web interface openvas launch web browser navigate type webinar username fill admin password fill select sign select scan display task page wizard icon upper left portion page select task wizard open task wizard dialog initiate comprehensive scan single target network typing ip address ip address hostname fill selecting start scan select cancel select wizard icon time select advanced task wizard,"['vulnerability identification', 'security manager', 'choose vulnerability']"
Page 5,open advanced task wizard dialog dialogue initiate scan control scan parameter one flexible parameter change type scan perform select scan config drop arrow select discovery type target host fill select create initiate discovery scan network carry scan find node running network nature port scanning iterative process mean common approach start high level scan create detailed scan based information received previous scan layer example firstlevel scan might include operating system fingerprint pas mean attempt determine operating system node taking result phase one scan next scan could search common port might open based detected operating system approach requires many scan lot repetitive activity increase consistency reduce error automation help simplify multiple layer scan automation simple writing script call command line utility utilising comprehensive scanner nessus open bass automating activity regardless nature tool recommended automate scan much possible reduce workload finding vulnerability cuserskassem anisonedrive debreceni egyetemasztalhpotestvideosdmp important part vulnerability management determining vulnerability exist scope environment standard approach discovering vulnerability compare current hardware software inventory repository known vulnerability knowing use vulnerability repository avoid limitation help avoid missing important vulnerability multiple source vulnerability repository available list database repository publicly available others available subscription regardless repository may choose use important inventory express hardware software component way query repository matching vulnerability likewise use standard vocabulary describing vulnerability severity possible mitigation open web browser navigate http colon slash slash cvemitreorg cde stand common vulnerability exposure list publicly disclosed security flaw maintained mitre organisation one common repository vulnerability thats published world select search cve,"['discovering vulnerability', 'vulnerability management', 'scan config']"
Page 6,list type apache search box select submit result show list known published vulnerability apache web server least include word apache notice record match search scroll see there lot lot vulnerability posted let select one see description specific cve id entry description vulnerability date record created lot information vulnerability vulnerability repository dramatically reduce time required identify vulnerability theyre useful content repository current since new vulnerability discovered daily date vulnerability repository may miss crucial vulnerability could allow attacker compromise environment thats important continually scan network running service compare result online uptodate vulnerability repository make sure youre aware every vulnerability could impact environment cuserskassem anisonedrive debreceni egyetemasztalhpotestvideosdmp publicly available vulnerability repository ease burden identifying vulnerability using industry standard tool carry vulnerability identification reduces amount time required increase quality vulnerability identification process finding vulnerability along severity information assist assessor determining vulnerability warrant strongest response still substantial work done using standard tool increase effectiveness making recommendation crafting policy aligned industrywide best practice many tool including nest openvas even legacy microsoft baseline security analyser mbsa correlate finding online publicly available vulnerability repository produce standard output report easy understand use decisionmaking security manager web interface openvas launch web browser navigate type web admin username fill admin password fill select sign select scan task go task page scroll see three scan complete one still process first scan scan ip address thats actually current virtual machine severity show little concern indicates node appears relatively secure already next scan however different story ip address another virtual machine thats running older version ubuntu configured deliberately insecure see,"['vulnerability repository', 'vulnerability apache', 'vulnerability identification']"
Page 7,openvas agrees assessment severity mean node need attention select second report see detail let select result see list finding sorted severity generally mitigate severe vulnerability first let select cbe see vulnerability map entry cve list select link list see detail cbe let select first entry first cbe entry first looked cve list overwhelming although go cve website search vulnerability lot easier let scanning tool find vulnerability correlate existing cve entry scroll get overview vulnerability detected lot supporting information confirm validate determining one strongest reason use tool like openvas nessus another integrated scanning platform give information one place determine respond vulnerability quick look openvas brief overview product many robust feature help cybersecurity professional keep environment secure cuserskassem anisonedrive debreceni egyetemasztalhpotestvideosdmp want greatest advantage hyperconnected world easy dig information subject many online resource provide threat intelligent information learning drawing current threat intelligence prerequisite effective vulnerability management program one commonly referenced repository vulnerability one weve already seen common vulnerability exposure cve list cbe maintained mitre corporation first go examining researching vulnerability cve source vulnerability threat comprehensive threat intelligence program include staying date cybersecurity report news item relate cybersecurity free subscriptionbased service participating collective intelligence exchange let go online look couple resource available help stay current ongoing threat open web browser navigate http colon slash slash cve website cbe website search cbe list entering keywords correspond service software installed weve already done also go data feed provide multiple source information subscribe consume website keep uptodate security information take time look,"['vulnerability cve', 'researching vulnerability', 'vulnerability correlate']"
Page 8,various source security information find one speaks organisation use stay date another great resource find various threat intelligent feed found http colon slash slash securitycom intelligence dash feed type youll find great resource threat intelligent feed spend time scrolling resource website youll find source information speaks nearly every industry category almost definitely youll find several source keep speed whats going respect threat intelligence important one course include department homeland security fbi guard portal one many cybersecurity professional use there ransomware tracker sand internet storm center another resource would recommend take look course there many idea develop ongoing process staying date whats going cybersecurity world cuserskassem anisonedrive debreceni egyetemasztalhpotestvideosdmp threat intelligence awareness operates least two level important stay abreast current state cybersecurity ongoing threat sometimes necessary dig little deeper suspected activity discovered ad hoc threat intelligence describes process researching suspicious activity determine activity result potential attack preparation attack ongoing thread intelligent preparedness process frequently visiting site resource contain update news summary ongoing cybersecurity topic automating thread intelligence activity absolute necessity keep fastchanging security landscape automation include scripting frequent vulnerability scan utilising vulnerability assessment suite automation feature integrating schedule scan updated vulnerability database security feed many information feed provide apis allow sophisticated script automatically investigate vulnerability result help stay current emerging threat let take look online threat intelligence resource first naked security http colon slash slash make securitycom make security publisher podcast pertinent article cover current cybersecurity topic article sorted date could search keyword find youre looking next resource sans internet storm center http colon slash slash iscu sand internet storm center one core resource every cybersecurity professional frequent page give access podcasts diary entry security,"['current cybersecurity', 'resource cybersecurity', 'ongoing cybersecurity']"
Page 9,related resource article searching diary provide wealth information security topic threat post thread post http colon slash slash threatpost yet another resource offer podcasts article current security topic many tool resource already seen support automating collection analysis updated threat intelligence explore resource find automation help reduce daily workload keeping current cuserskassem anisonedrive debreceni egyetemasztalhpotestvideosdmp first step crafting penetration test cybersecurity attack carrying comprehensive vulnerability assessment enumeration phase enumeration developing architectural detail plan target environment reason enumeration important vulnerability management process whole purpose find vulnerability known affect hardware software component network hardware software asset list incorrect date youre going miss potentially harmful vulnerability environment critical component comprehensive vulnerability management program ensuring documentation pertaining environment accurate uptodate asset list network map policy procedure documentation periodically reviewed updated reflect current state environment likewise documentation reviewed whenever security incident occurs incident resolved since security incident occur attacker exploit gap important address gap document change made assume food fresh added new web server environment handle new line allergen free food product administrator neglect add new web server hardware software asset list subsequent vulnerability assessment ignore new web server potentially miss vulnerability present omitting specific server service always lead attack open door potential vulnerability found attacker system owner looking resource change management process important security keeping documentation date may easy make environment much secure shorten time required respond incident,"['vulnerability assessment', 'vulnerability management', 'vulnerability environment']"
Page 10,cuserskassem anisonedrive debreceni egyetemasztalhpotestvideosdmp may heard term risk management vulnerability management used interchangeably reality vulnerability management risk management related distinct activity understanding difference vulnerability risk help security professional develop effective strategy avoid cyber attack vulnerability weakness environment could allow attacker carry successful attack carry successful attack attack must carry exploit vulnerability risk likelihood action may occur effect organisation along magnitude impact organisation case conversation cybersecurity consider risk refer adverse event regardless approach used assess risk primary goal create list known risk sorted likelihood effect organisation action exploit vulnerability successfully referred realised risk realise risk always effect organisation one likely occur highest negative impact one addressed first one approach mitigating risk mitigate vulnerability could allow risk realised thats vulnerability management risk management related process cuserskassem anisonedrive debreceni egyetemasztalhpotestvideosdmp two main approach assessing managing risk qualitative quantitative important security professional understand qualitative quantitative risk assessment method know use one build effective risk response plan qualitative risk assessment assigns subjective level risk based individual risk likelihood occurrence effect organisation organisation define level risk common risk level include low medium high extremely high risk likely occur several time year result loss several hundred thousand dollar occurrence would likely assigned risk high extremely high hand risk expected realised every year expected loss per occurrence would assigned risk level low qualitative risk assessment good comparing relative importance different risk comparing monetary impact quantitative risk assessment assigns number easy calculate use,"['vulnerability management', 'risk management', 'management vulnerability']"
Page 11,formula determine expected loss risk sign probability occurrence dollar value loss risk realised dollar value realised risk loss easy calculate multiplying occurrence probability time loss expectancy quantitative risk analysis make easy write risk expected loss year quantitative risk assessment work well number available largely automated however occurrence probability expected loss number estimate often case personnel worked closely resource risk may provide valuable input risk assessment process reason recommended use qualitative quantitative risk assessment compare result best result analysis type would list risk ranked manner practice list likely slightly different require management make decision allocate limited budget risk mitigation cuserskassem anisonedrive debreceni egyetemasztalhpotestvideosdmp breach identified risk generally four mitigation option organisation choose four depending applicability specific risk one way mitigate risk avoidance risk completely avoided without excessive cost avoided example avoidance disabling removing unneeded service example database server old insecure web server running computer unused web service may vulnerable attack disabling web service completely uninstalling web service remove vulnerability risk associated another risk mitigation strategy acceptance risk realised cause little negative impact organisation best strategy may simply accept risk trying mitigate risk using technique would cost loss expected acceptance may best choice risk accepted avoided may best handled controlled controlling risk mean deploy security control reduces probability risk exploited successfully realised threat adding firewall id ip implementing nfa example deploying security control mitigation strategy finally last risk mitigation strategy transfer risk transferring risk result agreement risk realised loss would covered another party insurance one common risk transference approach think personal vehicle personal car insurance,"['risk assessment', 'risk analysis', 'risk mitigation']"
Page 12,agreement account holder insurance provider exchange periodic premium pay insurance provider insurance provider agrees pay loss due various type damage key aspect risk management understand risk posed danger organisation mitigation strategy provides economical protection risk cuserskassem anisonedrive debreceni egyetemasztalhpotestvideosdmp possum risk global across organisation risk target specific data data disclosure risk data disclosed data information system store process protected disclosure data marked sensitive protected controlled disclosure understanding data classification affect security control need important building effective security common class protected data include personally identifiable information pii personal health information phi pii phi common target standard regulation ensure type data protected pcidss gdpr hipa standard regulation set requirement pii phi handled special classification certain type data come additional risk example disclosing consumer private information pii organisation subject gdpr may result risk fine loss privilege gdpr place level restriction nonpersonal data way data classification play overall risk management short type data carry risk type data cuserskassem anisonedrive debreceni egyetemasztalhpotestvideosdmp comprehensive security assessment system span hardware software component within infrastructure device role inform level assessment ensure utmost security component yield effective security plan server sensitive information require higher level security device may target attack however device may provide incremental access higher value server must assessed overall process well remember security state rather process organisation may take security snapshot point time change,"['data protected', 'protected data', 'risk data']"
